{
  "id": "550e8400-e29b-41d4-a716-446655440400",
  "organization_id": "550e8400-e29b-41d4-a716-446655440001",
  "client_id": "550e8400-e29b-41d4-a716-446655440300",
  "name": "ACME Website Redesign",
  "color": "#3B82F6",
  "is_billable": true,
  "billable_rate": 150,
  "estimated_time": 144000,
  "is_archived": false,
  "is_public": false,
  "created_at": "2026-01-05T00:00:00Z",
  "updated_at": "2026-01-09T00:00:00Z"
}
